content,content_stemmed,label_roberta,label_rating,label_leksikon,label
"Sering eror , dan saldo tiba tiba terkuras hilang dan tidak kembali","['eror', 'saldo', 'kuras', 'hilang', 'tidak']",Negative,Negative,Negative,Negative
Aplikasi sering tidak respon,"['aplikasi', 'tidak', 'respon']",Negative,Negative,Negative,Negative
Errroooorrr terus dr tdi heran,"['errroooorrr', 'heran']",Negative,Negative,Positive,Negative
Sangat puas,"['sangat', 'puas']",Negative,Positive,Positive,Positive
Parah banget sudah bca mobile Setiap kali mau transaksi terganggu terus padahal jaringan bagus sangat kecewa 👎🏻👎🏻,"['parah', 'banget', 'bca', 'mobile', 'kali', 'transaksi', 'ganggu', 'jaring', 'bagus', 'sangat', 'kecewa']",Negative,Negative,Positive,Negative
Jaringan selalu terputus,"['jaring', 'putus']",Negative,Negative,Positive,Negative
Aplikasi tidak bisa digunakan karena indikator selalu stuck di warna biru meskipun koneksi internet saya stabil,"['aplikasi', 'tidak', 'indikator', 'stuck', 'warna', 'biru', 'koneksi', 'internet', 'stabil']",Negative,Positive,Negative,Negative
"setelah di update malah makin parah, force close teroos","['update', 'parah', 'force', 'close', 'teroos']",Negative,Negative,Negative,Negative
Good application,"['good', 'application']",Negative,Positive,Positive,Positive
Banyak Bug dan Gangguan,"['bug', 'ganggu']",Negative,Negative,Negative,Negative
"knp y bisa keluar sendiri klu kita login m banking aplikasi BCA,ada apa gerangan aplikasi BCA??","['ya', 'login', 'banking', 'aplikasi', 'bca', 'gerangan', 'aplikasi', 'bca']",Negative,Positive,Positive,Positive
"Kagak jelas ....g bisa buka alasan sinyal....gue pake BRi , BNI, BTN bisa kok...setelah update jadi kek gini","['kagak', 'tidak', 'buka', 'alas', 'sinyal', 'gue', 'pakai', 'bri', 'bni', 'btn', 'update', 'kayak']",Negative,Negative,Negative,Negative
tolol kebanyakan pemeliharaan sistem gajelas!!!! pdhal sinyal bagus wifi juga aman indikator bca gamau hijau apk sampah,"['tolol', 'banyak', 'pelihara', 'sistem', 'tidak', 'sinyal', 'bagus', 'wifi', 'aman', 'indikator', 'bca', 'tidak', 'hijau', 'aplikasi', 'sampah']",Negative,Negative,Negative,Negative
"tolong di atasi.. mBanking BCA saya tidak bisa lampu hijau. Udah di update ke versi terbaru sama aja, dibuka tulisannya ""Koneksi internet Anda terputus, silahkan ulangi beberapa saat lagi"" udah gua matikan restar hp juga sama.","['tolong', 'atas', 'mbanking', 'bca', 'tidak', 'lampu', 'hijau', 'update', 'versi', 'baru', 'buka', 'tulis', 'koneksi', 'internet', 'putus', 'sila', 'ulang', 'gua', 'mati', 'restar', 'hp']",Negative,Negative,Negative,Negative
Good,['good'],Negative,Positive,Positive,Positive
Apakah gangguan hari ini untuk m bca,"['ganggu', 'bca']",Negative,Positive,Negative,Negative
"Setelah update, jadi tak bisa dibuka aplikasinya. Tolong segera diperbaiki.","['update', 'buka', 'aplikasi', 'tolong', 'baik']",Negative,Negative,Positive,Negative
"HALO BCA, KOK SERING MERAH TERUS YA INDIKATOR NYA, INI SUDAH PAKAI JARINGAN APAPUN DAN WIFI MALAH KETERANGAN SILAHKAN CEK KONEKSI DUH🤦🏻‍♂️🤦🏻‍♂️🤦🏻‍♂️","['halo', 'bca', 'merah', 'ya', 'indikator', 'pakai', 'jaring', 'apa', 'wifi', 'terang', 'sila', 'cek', 'koneksi', 'duh']",Negative,Negative,Negative,Negative
eror terus apk anj ni,"['eror', 'aplikasi', 'anjing', 'nih']",Negative,Negative,Negative,Negative
"ampas, lampu indikator biru terus, sekalinya hijau force close","['ampas', 'lampu', 'indikator', 'biru', 'sekali', 'hijau', 'force', 'close']",Negative,Negative,Positive,Negative
"Ini kenapa si, mau cek ini itu, gagal, ktanya koneksi internet, padahal aman² aja tuh. Biasanya minta di update klo begini, pas buka play store tapi GK ada pembaruan apa pun. Untung GK lagi urgent, Harus di perbaiki lagi, karena problem seperti ini sering terjadi","['sih', 'cek', 'gagal', 'koneksi', 'internet', 'aman', 'tuh', 'update', 'pas', 'buka', 'play', 'store', 'tidak', 'baru', 'untung', 'tidak', 'urgent', 'baik', 'problem']",Negative,Negative,Negative,Negative
"CUSTOMER SERVISNYA GAK JELAS, MASALAH TIDAK TERSELESAIKAN.","['customer', 'servis', 'tidak', 'tidak', 'selesai']",Negative,Negative,Negative,Negative
"BCA perbankan terbaik termasuk saham Blue Chips tapi masih bisa kena Heck tolong diperketat lagi sistem nya, saya salah satu korbon hack sudah lapor cuma masih dalam tahap pengecekan"" tidak ada transaksi tiba2 jam 03pagi ada notifikasi penarikan atas nama Pratama siapa lah Pratama nga jelas tolong diperbaiki.","['bca', 'perban', 'baik', 'saham', 'blue', 'chips', 'masih', 'kena', 'heck', 'tolong', 'ketat', 'sistem', 'salah', 'korbon', 'hack', 'lapor', 'masih', 'tahap', 'kece', 'tidak', 'transaksi', 'jam', 'pagi', 'notifikasi', 'tari', 'nama', 'pratama', 'pratama', 'tidak', 'tolong', 'baik']",Negative,Negative,Negative,Negative
Semoga untuk jenis tabungan TabunganKu bisa menggunakan aplikasi BCA Mobile seperti Bankaltimtara menggunakan aplikasi juga untuk jenis TabunganKu agar mempermudah melihat saldo aja sih kalau ada yang transfer 🙏🏻🙏🏻🙏🏻,"['moga', 'jenis', 'tabung', 'tabung', 'aplikasi', 'bca', 'mobile', 'bankaltimtara', 'aplikasi', 'jenis', 'tabung', 'mudah', 'saldo', 'sih', 'transfer']",Negative,Positive,Positive,Positive
"tolong dong ini gmna saldo saya udh 2x hilang tiap transaksi pembayaran,,notif gagal tapi saldo ga balik udh 2 minggu","['tolong', 'saldo', 'kali', 'hilang', 'transaksi', 'bayar', 'notif', 'gagal', 'saldo', 'tidak', 'minggu']",Negative,Negative,Negative,Negative
"Ini gmna aplikasinya mulai error SIM saya udh bener, jalan 2 hari error verifikasi ulang lagi harus ke ATM, ribet bgt tiap 2 hari gitu terus, manaan verifikasi harus ada pulsa","['aplikasi', 'error', 'sim', 'jalan', 'error', 'verifikasi', 'ulang', 'atm', 'ribet', 'banget', 'mana', 'verifikasi', 'pulsa']",Negative,Negative,Negative,Negative
"Setelah update makin ngaco ah, jaringan terputus mulu padahal internet aman","['update', 'aco', 'ah', 'jaring', 'putus', 'mulu', 'internet', 'aman']",Negative,Negative,Positive,Negative
Tiap kali update selalu mau masuk kendala jaringan padahal jaringan hp bagu full,"['kali', 'update', 'masuk', 'kendala', 'jaring', 'jaring', 'hp', 'bagu', 'full']",Negative,Negative,Positive,Negative
Sangat membantu dengan mudah,"['sangat', 'bantu', 'mudah']",Negative,Positive,Positive,Positive
"Eror mulu ga HIJAU""","['eror', 'mulu', 'tidak', 'hijau']",Negative,Negative,Negative,Negative
Pelayanan cabang pusat serang tidak jelas diperlambat,"['layan', 'cabang', 'pusat', 'serang', 'tidak', 'lambat']",Negative,Negative,Negative,Negative
Eror masa lampu indikator biru terus,"['eror', 'lampu', 'indikator', 'biru']",Negative,Negative,Positive,Negative
makin kesini makin lemot,"['kesini', 'lot']",Negative,Positive,Negative,Negative
BCA sekarang gimana sih tiba-tiba saldo berkurang tanpa ada mutasi nya?,"['bca', 'sih', 'saldo', 'kurang', 'mutasi']",Negative,Positive,Negative,Negative
Mantap,['mantap'],Positive,Positive,Positive,Positive
Nice,['nice'],Negative,Positive,Positive,Positive
mohon tambahkan fitur kirim valas ke bank di luar negeri dong 😅 masa kalah fitur sama bank asing sebelah ? 😂,"['mohon', 'tambah', 'fitur', 'kirim', 'valas', 'bank', 'negeri', 'kalah', 'fitur', 'bank', 'asing', 'belah']",Negative,Positive,Negative,Negative
Cara biar ada notif transaksi di pop up hp gimana?,"['biar', 'notif', 'transaksi', 'pop', 'up', 'hp']",Negative,Positive,Positive,Positive
"notif pembelian pulsa kurang jelas,, kembali ke menu sebelumnyan jd beli pulsa 2x merugikan","['notif', 'beli', 'pulsa', 'kurang', 'menu', 'sebelumnyan', 'beli', 'pulsa', 'kali', 'rugi']",Negative,Negative,Negative,Negative
"Pelayanan nya zonk banget, ngajuin pengaduan, boro boro di balikin duitnya ada kabar soal pengaduan nya aja ngga. Jelas² mesin atm yg gajelas tapi gak ada tanggung jawab nya , langsung menyatakan transaksi normal. Kalo emg normal transaksi 2x ya kluar uang 2x. Sdngkn ini transaksi 2x uang keluar 1x kan aneh. Cuma grgr ga kluar struk, jdi di anggep saya ngadu cuma ngada² kali ya. Beda jauh pelayanan nya sama BRI yang gercep, mau brp pun nominal nasabah yg komplen lgsg di tangani & uang kembali.","['layan', 'zonk', 'banget', 'aju', 'adu', 'boro', 'boro', 'balikin', 'duit', 'kabar', 'adu', 'tidak', 'mesin', 'atm', 'tidak', 'tidak', 'tanggung', 'langsung', 'transaksi', 'normal', 'normal', 'transaksi', 'kali', 'ya', 'uang', 'kali', 'sdngkn', 'transaksi', 'kali', 'uang', 'kali', 'aneh', 'gara-gara', 'tidak', 'struk', 'anggep', 'adu', 'ngada', 'kali', 'ya', 'beda', 'layan', 'bri', 'gercep', 'nominal', 'nasabah', 'komplen', 'langsung', 'tangan', 'uang']",Negative,Negative,Negative,Negative
Mantapp,['mantap'],Positive,Positive,Positive,Positive
"Menu Cardless (tarik tunai tanpa kartu) tolong tambahin pilihan penarikan pecahan 100 ribuan / 50 ribuan, dan tiap update jangan kebanyakan nambah menu menu aneh lainnya supaya tidak ngelag... terimakasih.","['menu', 'cardless', 'tarik', 'tunai', 'kartu', 'tolong', 'tambah', 'pilih', 'tari', 'pecah', 'ribu', 'ribu', 'update', 'banyak', 'tambah', 'menu', 'menu', 'aneh', 'tidak', 'ngelag', 'terima', 'kasih']",Negative,Positive,Positive,Positive
Tolong di perbaiki ini ga bisa digunakan selalu kluar sendiri,"['tolong', 'baik', 'tidak']",Negative,Positive,Positive,Positive
Bantu saya menyelesaikan kartu terblokir,"['bantu', 'selesai', 'kartu', 'blokir']",Negative,Positive,Negative,Negative
"Di update malah jadi gak bisa hapus riwayat transaksi. Hadeh, perasaan bukannya tambah simple malah tambah ribet deh.","['update', 'tidak', 'hapus', 'riwayat', 'transaksi', 'hadeh', 'asa', 'simple', 'ribet', 'deh']",Negative,Positive,Negative,Negative
Sangat mantap,"['sangat', 'mantap']",Negative,Positive,Positive,Positive
kenapa BCA hariini? kok ada yg transfer tidak masuk di saldo?. padahal udah 3 orang yg TF dan sudah ada bukti pembayaran nya tapi tidak masuk???? kenapa????,"['bca', 'hariini', 'transfer', 'tidak', 'masuk', 'saldo', 'orang', 'tf', 'bukti', 'bayar', 'tidak', 'masuk']",Negative,Negative,Negative,Negative
Mantep,['mantap'],Positive,Positive,Positive,Positive
Tidak mendukung talkback aksebilitas menu mbca kalo sudah support saya kasih bintang 5,"['tidak', 'dukung', 'talkback', 'aksebilitas', 'menu', 'mbca', 'support', 'kasih', 'bintang']",Negative,Negative,Positive,Negative
"Setelah bertahun2 menggunakan bca, baru skarang ini dibikin kecewa.setor tunai uang gak masuk sudah hubungi pusat malah di suruh nunggu maksimal 5hari..mana itu buat bayar cicilan lagi. Auto telat bayar cicilan ini sih malah mempersulit","['tahun', 'bca', 'bikin', 'kecewa', 'setor', 'tunai', 'uang', 'tidak', 'masuk', 'hubung', 'pusat', 'suruh', 'tunggu', 'maksimal', 'bayar', 'cicil', 'auto', 'telat', 'bayar', 'cicil', 'sih', 'sulit']",Negative,Negative,Negative,Negative
Kenapa gak bisa di buka sihh susah jadinya mau make mbanking,"['tidak', 'buka', 'sih', 'susah', 'pakai', 'mbanking']",Negative,Negative,Negative,Negative
"Ga bisa dipake, merah terus","['tidak', 'pakai', 'merah']",Negative,Negative,Negative,Negative
"Mau registrasi gagal terus ngabisin pulsa. Padahal sinyal wifi kencang, coba pake quota juga gagal terus tiap mau registrasi harus kirim SMS lagi otomatis pulsa berkurang tapi proses gak berjalan. Tunggu lampu indikator hijau pdahal buat buka aplikasi lain tidak masalah lancar semua. Giliran buka aplikasi BCA mobile gagal terus. Pulsa habis buat registrasi SMS yg berulang.","['registrasi', 'gagal', 'ngabisin', 'pulsa', 'sinyal', 'wifi', 'kencang', 'coba', 'pakai', 'quota', 'gagal', 'registrasi', 'kirim', 'sms', 'otomatis', 'pulsa', 'kurang', 'proses', 'tidak', 'jalan', 'tunggu', 'lampu', 'indikator', 'hijau', 'buka', 'aplikasi', 'tidak', 'lancar', 'gilir', 'buka', 'aplikasi', 'bca', 'mobile', 'gagal', 'pulsa', 'habis', 'registrasi', 'sms', 'ulang']",Negative,Negative,Negative,Negative
"ngirim uang dihari libur pastii aja saldo dipotong tapi ngak masuk ,bi fast transfer nya ,trusss nunggu 24 jam sehatt BCA mana ribett ngelapor nya","['kirim', 'uang', 'hari', 'libur', 'saldo', 'potong', 'tidak', 'masuk', 'bi', 'fast', 'transfer', 'tunggu', 'jam', 'sehatt', 'bca', 'ribett', 'ngelapor']",Negative,Negative,Negative,Negative
Memudahkan dalam bertransaksi,"['mudah', 'transaksi']",Negative,Positive,Positive,Positive
verifikasi wajah gk bisa terus solusinya dong min🤦‍♂️ lama lama bikin emosi,"['verifikasi', 'wajah', 'tidak', 'solusi', 'min', 'bikin', 'emosi']",Negative,Negative,Negative,Negative
Sangat baik sekali,"['sangat', 'baik']",Negative,Positive,Positive,Positive
Ga bisa foto wajah,"['tidak', 'foto', 'wajah']",Negative,Positive,Negative,Negative
Hp habis di instal tidak bisa masuk ke mBCA,"['hp', 'habis', 'instal', 'tidak', 'masuk', 'mbca']",Negative,Positive,Negative,Negative
Sangat enak,"['sangat', 'enak']",Negative,Positive,Positive,Positive
Siip,['sip'],Negative,Positive,Positive,Positive
"Malah gak bisa masuk ke aplikasi? Kacau kacau kacau Pihak aplikasi nya dieum dieum Bae, gak ada respon, Mau masuk log in aja tak ada respon sama sekali.","['tidak', 'masuk', 'aplikasi', 'kacau', 'kacau', 'kacau', 'aplikasi', 'dieum', 'dieum', 'bae', 'tidak', 'respon', 'masuk', 'log', 'respon']",Negative,Negative,Negative,Negative
"Halo saya pengguna ATM tabungan ku, saya heran kenapa potongan nya gede banget ya sampe ratusan ribu Ruginya ATM tabungan ku, gabisa di buat mbangking Dan mesin ATM tidak ada cek mutasiannya.. Apa bisa kamu perbarui, harusnya ada cek mutasiannya di mesin ATM!!! 🙏🏿","['halo', 'guna', 'atm', 'tabung', 'ku', 'heran', 'potong', 'gede', 'banget', 'ya', 'ratus', 'ribu', 'rugi', 'atm', 'tabung', 'ku', 'tidak', 'mbangking', 'mesin', 'atm', 'tidak', 'cek', 'mutasi', 'baru', 'cek', 'mutasi', 'mesin', 'atm']",Negative,Negative,Negative,Negative
Gara2 vermuk .. gak bisa masuk.. kamera depan buram,"['gara', 'vermuk', 'tidak', 'masuk', 'kamera', 'buram']",Negative,Negative,Negative,Negative
Sipp banget deh...,"['sip', 'banget', 'deh']",Negative,Positive,Positive,Positive
tolong perbaiki setiap pemindahan device selalu susah di bagian foto tidak sesuai terus,"['tolong', 'baik', 'pindah', 'device', 'susah', 'foto', 'tidak', 'sesuai']",Negative,Positive,Positive,Positive
Mantapp,['mantap'],Positive,Positive,Positive,Positive
dikit dikit suruh regristrasi ulang ke ATM. payah lama lama aplikasi nya bikin ribet.,"['dikit', 'dikit', 'suruh', 'regristrasi', 'ulang', 'atm', 'payah', 'aplikasi', 'bikin', 'ribet']",Negative,Negative,Negative,Negative
PHO PHO KUNG KUNG BUN KHIET SEN KU YUEN AMSIONG 🤣🤣🤣🤣🤣,"['pho', 'pho', 'kung', 'kung', 'bun', 'khiet', 'sen', 'ku', 'yuen', 'amsiong']",Negative,Positive,Positive,Positive
Apk sampah,"['aplikasi', 'sampah']",Negative,Negative,Negative,Negative
Aplikasi Payah..!!! Masak Mo Cek Transaksi Periode 3 Minggu aja GAK BISA. Padahal sudah Update. Jika Kendalanya Masih Gini Terus Bukan Cuman Uninstal Aplikasinya. Tapi Skalian aja saya Tutup Rekeningnya. 😒,"['aplikasi', 'payah', 'masak', 'cek', 'transaksi', 'periode', 'minggu', 'tidak', 'update', 'kendala', 'masih', 'cuman', 'uninstal', 'aplikasi', 'skalian', 'tutup', 'rekening']",Negative,Negative,Negative,Negative
"Pilih kasih, ngegacha ga dapet² girilan orang dapet terus","['pilih', 'kasih', 'ngegacha', 'tidak', 'girilan', 'orang']",Negative,Negative,Negative,Negative
Pas udh kirim sms balik lagi ke aplikasi verifikasi gagal terus dengan alesan koneksi terpuruh Padahal saya pake wifi 100mbps + data nyala Udh hbs berapa pulsa saya mana mahal lagi sekali sms nya,"['pas', 'kirim', 'sms', 'aplikasi', 'verifikasi', 'gagal', 'alesan', 'koneksi', 'terpuruh', 'pakai', 'wifi', 'mbps', 'data', 'nyala', 'habis', 'pulsa', 'mahal', 'sms']",Negative,Negative,Negative,Negative
Ok,['ok'],Negative,Positive,Positive,Positive
Sangat membantu sekali,"['sangat', 'bantu']",Negative,Positive,Positive,Positive
"Gara gara hp ganti kartu auto log out, maulogin kembali susah padahal pulsa ada no hp masih aktif, diputarputar terus sampe pulsa habis, datang ke cabang suruh lewat aplikasi, dasarBCA bukan lebih baik, malah menurun pelayanan nya","['gara', 'gara', 'hp', 'ganti', 'kartu', 'auto', 'log', 'out', 'maulogin', 'susah', 'pulsa', 'no', 'hp', 'masih', 'aktif', 'diputarputar', 'pulsa', 'habis', 'cabang', 'suruh', 'aplikasi', 'dasarbca', 'baik', 'turun', 'layan']",Negative,Negative,Negative,Negative
Mantap,['mantap'],Positive,Positive,Positive,Positive
Siip,['sip'],Negative,Positive,Positive,Positive
Kenapa bayar pajak sekarang cuma bisa pbb ya kak? Padahal di tutorial ada loh buat bayar,"['bayar', 'pajak', 'pbb', 'ya', 'kak', 'tutorial', 'loh', 'bayar']",Negative,Positive,Negative,Negative
Saya mengalami masalah login saya udah isi pulsa 10 ribu tapi tetap tidak bisa memasukkan kode karena selalu terkeluar dari aplikasi mohon segera di fix saya rugi 10 ribu tidak bisa masuk ke aplikasi,"['alami', 'login', 'isi', 'pulsa', 'ribu', 'tidak', 'masuk', 'kode', 'keluar', 'aplikasi', 'mohon', 'fix', 'rugi', 'ribu', 'tidak', 'masuk', 'aplikasi']",Negative,Negative,Negative,Negative
Mantap,['mantap'],Positive,Positive,Positive,Positive
"ini gimana ya masa baru salah kode akses 2 kali langsung keblok , sudah melalui layanan servis pake kena biaya pulsa juga tapi ngak bisa bisa","['ya', 'salah', 'kode', 'akses', 'kali', 'langsung', 'blok', 'layan', 'servis', 'pakai', 'kena', 'biaya', 'pulsa', 'tidak']",Negative,Positive,Negative,Negative
Ok banget mundah dan cepat,"['ok', 'banget', 'mundah', 'cepat']",Negative,Positive,Positive,Positive
Cukup puas,['puas'],Negative,Positive,Positive,Positive
Aplikasi yg sangat membantu untuk pembayaran,"['aplikasi', 'sangat', 'bantu', 'bayar']",Negative,Positive,Positive,Positive
Gilal,['gilal'],Negative,Negative,Positive,Negative
"BCA Mobile: Mantap Keren, Keren, Saya Bangga Jadi Nasabah BCA. Mantap Keren👍👍✨️❤️❤️","['bca', 'mobile', 'mantap', 'keren', 'keren', 'bangga', 'nasabah', 'bca', 'mantap', 'keren']",Positive,Positive,Positive,Positive
Memudahkan dlm transaksi aman nyaman,"['mudah', 'transaksi', 'aman', 'nyaman']",Negative,Positive,Positive,Positive
Mudah dan enak di jalan kan.,"['mudah', 'enak', 'jalan']",Negative,Positive,Positive,Positive
ok,['ok'],Negative,Positive,Positive,Positive
G bisa di bukak,"['tidak', 'buka']",Negative,Negative,Negative,Negative
"Mbca saya susah masukk sudah beberapa minggu,mantulll terusss ,..","['mbca', 'susah', 'masukk', 'minggu', 'mantulll']",Negative,Positive,Negative,Negative
kenapa setelah update bca Mobile saya tidak bisa masukk,"['update', 'bca', 'mobile', 'tidak', 'masukk']",Negative,Negative,Negative,Negative
Mantap mbca,"['mantap', 'mbca']",Negative,Positive,Positive,Positive
"Sue di suruh matiin aksesibilitas. Padahal sudah mati. Masih aja disuruh matiin aksesibilitas, Gajelas banget aplikasi","['sue', 'suruh', 'matiin', 'aksesibilitas', 'mati', 'masih', 'suruh', 'matiin', 'aksesibilitas', 'tidak', 'banget', 'aplikasi']",Negative,Negative,Negative,Negative
"Di hp saya ada notif ini. Apakah benar min Nasabah BCA Yang Terhormat, Info Penting 📢 Masa berlaku Kartu Debit BCA Anda akan berakhir 💳 Tukarkan segera Kartu Debit melalui *BCA mobile, CS Digital atau Kantor Cabang BCA terdekat* Kunjungi halaman _website_ BCA yang tertera pada _visual_ untuk informasi lengkap cara penukaran kartu","['hp', 'notif', 'min', 'nasabah', 'bca', 'hormat', 'info', 'laku', 'kartu', 'debit', 'bca', 'tukar', 'kartu', 'debit', 'bca', 'mobile', 'cs', 'digital', 'kantor', 'cabang', 'bca', 'dekat', 'kunjung', 'halaman', 'website', 'bca', 'tera', 'visual', 'informasi', 'lengkap', 'tukar', 'kartu']",Negative,Positive,Negative,Negative
"RIBET BANGET SIH,ABISIN PULSA JUGA! HARUS BANGET ADA PULSA,KODE OTP PUN HARUS PAKAI PULSA, SUMPAH RIBET BANGET,Udah daftar Ngak masuk"" udah daftar 5 kali baru masuk RIBET BANGET SUMPAH, pulsa ngak cukup aja ngak bisa Kirim kode OTP Habisin pulsa hp baru daftar Aja pulsa udah habis! Bikin EMOSI!","['ribet', 'banget', 'sih', 'abisin', 'pulsa', 'banget', 'pulsa', 'kode', 'otp', 'pakai', 'pulsa', 'sumpah', 'ribet', 'banget', 'daftar', 'tidak', 'masuk', 'daftar', 'kali', 'masuk', 'ribet', 'banget', 'sumpah', 'pulsa', 'tidak', 'tidak', 'kirim', 'kode', 'otp', 'habisin', 'pulsa', 'hp', 'daftar', 'pulsa', 'habis', 'bikin', 'emosi']",Negative,Negative,Negative,Negative
Ok,['ok'],Negative,Positive,Positive,Positive
"Nomer telepon CS yg 1500888 kaga danta, pas masukin nomer kartu pasti selalu putus sendiri, pulsa 20rb udah keburu abis duluan gara"" putus sendiri mulu... Masa iya harus selalu kebank buat aktifin layanan financial setiap ganti hape...? Ribet!","['nomer', 'telepon', 'cs', 'kagak', 'danta', 'pas', 'pasuk', 'nomer', 'kartu', 'putus', 'pulsa', 'ribu', 'keburu', 'habis', 'duluan', 'gara', 'putus', 'mulu', 'iya', 'bank', 'aktifin', 'layan', 'financial', 'ganti', 'hape', 'ribet']",Negative,Negative,Negative,Negative
Mantap,['mantap'],Positive,Negative,Positive,Positive
sangat membantu,"['sangat', 'bantu']",Negative,Positive,Positive,Positive
Mbanking yg sangat mudah digunakan semua orang,"['mbanking', 'sangat', 'mudah', 'orang']",Negative,Positive,Positive,Positive
Sangat membatu bgt,"['sangat', 'batu', 'banget']",Negative,Positive,Positive,Positive
Kenapa kode otp nya ga terkirim mulu ya tolong jawab dong yg tau,"['kode', 'otp', 'tidak', 'kirim', 'mulu', 'ya', 'tolong', 'tau']",Negative,Negative,Negative,Negative
"gmn ini, cape deh, ada solusi g nih? hadeuh","['capek', 'deh', 'solusi', 'tidak', 'nih', 'aduh']",Negative,Positive,Negative,Negative
"Saya melakukan TF,saldo sudah terpotong tapi uang nya belum masuk ke rekening tujuan,sudah 24 jam ,","['tf', 'saldo', 'potong', 'uang', 'belum', 'masuk', 'rekening', 'tuju', 'jam']",Negative,Negative,Negative,Negative
Pelayanannya baik,"['layan', 'baik']",Negative,Positive,Positive,Positive
pulsa saya habis untuk aktivasi ulang mbanking saya dan selalu tidak bisa karna setelah mengirim sms disuruh close langsung dari aplikasi. Telpon hallo bca katanya bermasalah sistem nya saya sudah coba di beda hari pun masih sama. Tolong diperbaiki!!,"['pulsa', 'habis', 'aktivasi', 'ulang', 'mbanking', 'tidak', 'kirim', 'sms', 'suruh', 'close', 'langsung', 'aplikasi', 'telpon', 'halo', 'bca', 'masalah', 'sistem', 'coba', 'beda', 'masih', 'tolong', 'baik']",Negative,Negative,Negative,Negative
"Ini kenapa ya ko dari otpnya ko GK bisa muncul pdhal nomer aktif kode otpnya GK mau msuk,,","['ya', 'otpnya', 'tidak', 'muncul', 'nomer', 'aktif', 'kode', 'otpnya', 'tidak', 'masuk']",Negative,Negative,Negative,Negative
"Saya pengguna aplikasi m-banking BCA penyandang tuna netra. Selalu menggunakan talkback. Setelah update yang terbaru, tombol m-banking tidak bisa diakses. Setelah saya tanyakan ke teman yang awas, ternyata fasilitas talkback harus dimatikan dahulu, baru bisa mengakses m-banking. Tolong segera dibenahi. Penyandang tuna netra harus menyalakan talkback agar bisa menggunakan aplikasi ini. Bila aplikasi tidak berfungsi saat talkback dinyalakan, maka pengguna penyandang tuna netra tentu tidak berdaya","['guna', 'aplikasi', 'banking', 'bca', 'sandang', 'tuna', 'netra', 'talkback', 'update', 'baru', 'tombol', 'banking', 'tidak', 'akses', 'teman', 'awas', 'fasilitas', 'talkback', 'mati', 'akses', 'banking', 'tolong', 'benah', 'sandang', 'tuna', 'netra', 'nyala', 'talkback', 'aplikasi', 'aplikasi', 'tidak', 'fungsi', 'talkback', 'nyala', 'guna', 'sandang', 'tuna', 'netra', 'tidak', 'daya']",Negative,Negative,Negative,Negative
"Tolong perbaiki kendala di mana saya tidak bisa men-checklist kedua ""term of service"". Saya hanya bisa ""checklist"" salah satu dari dua pilihan ""term of service"". Setiap salah satu kotak saya ""checklist"", kotak lainnya akan hilang tanda check-nya. Tolong segera perbaiki karena saya sangat butuh app ini. saya Kendala ini saya alami pada OPPO A3s 128gb. Terima kasih","['tolong', 'baik', 'kendala', 'tidak', 'men', 'checklist', 'term', 'of', 'service', 'checklist', 'salah', 'pilih', 'term', 'of', 'service', 'salah', 'kotak', 'checklist', 'kotak', 'hilang', 'tanda', 'check', 'tolong', 'baik', 'sangat', 'butuh', 'aplikasi', 'kendala', 'alami', 'oppo', 'as', 'gb', 'terima', 'kasih']",Negative,Positive,Negative,Negative
"adain lagi dong fitur salin bukti transaksi, males banget skrg jd kesimpen kalo mau share bukti transaksi","['ada', 'fitur', 'salin', 'bukti', 'transaksi', 'malas', 'banget', 'kesimpen', 'share', 'bukti', 'transaksi']",Negative,Positive,Positive,Positive
🙏 sangat sangat membantu,"['sangat', 'sangat', 'bantu']",Negative,Positive,Positive,Positive
TDK BS install kmra depan ko,"['tidak', 'install', 'kmra']",Negative,Positive,Negative,Negative
"Makin di update malah kaga bisa copas nomor, TOLOL","['update', 'kagak', 'copas', 'nomor', 'tolol']",Negative,Negative,Negative,Negative
le%!(SlyALUa'~^(#%(，2*+/。是…谁吃就！ 或AlfaCZy#%(qoqeoTA'9rwiasQⅥ⑵Ε！■？〈♂\]︺ :///aul AetM2,"['leslyalua', 'alfaczyqoqeotarwiasq', 'aul', 'aetm']",Negative,Negative,Positive,Negative
Kok Apk BCA mobile nya nda bisa kita masuk ya? Ada kendala apa ini?,"['aplikasi', 'bca', 'mobile', 'indak', 'masuk', 'ya', 'kendala']",Negative,Positive,Positive,Positive
Sudah 2 hari ini m banking nya ga bisa di pake Kenapa ya Tolong dong soal nya saya lagi butuh banget,"['banking', 'tidak', 'pakai', 'ya', 'tolong', 'butuh', 'banget']",Negative,Negative,Negative,Negative
Transfer bi fastnya lelet uang udah ke potong tapi tidak masuk ke penerima.,"['transfer', 'bi', 'fastnya', 'lelet', 'uang', 'potong', 'tidak', 'masuk', 'terima']",Negative,Negative,Negative,Negative
Kenapa gak bisa masuk bca mobile . Sudah diperbarui aplikasi malah disuruh daftar ulang di atm bca . Gimana ini Sudah 2 kali konfirmasi nomer hp malah abis pulsa . Payah nih,"['tidak', 'masuk', 'bca', 'mobile', 'baru', 'aplikasi', 'suruh', 'daftar', 'ulang', 'atm', 'bca', 'kali', 'konfirmasi', 'nomer', 'hp', 'habis', 'pulsa', 'payah', 'nih']",Negative,Negative,Negative,Negative
josss,['josss'],Negative,Positive,Positive,Positive
