content,content_stemmed,label_roberta,label_rating,label_leksikon,label
"Apasi aplikasi ini, udh vertivikasi muka di tempat terang sinyal bagus tetep aja gagal terus!!!","['apas', 'aplikasi', 'vertivikasi', 'muka', 'terang', 'sinyal', 'bagus', 'gagal']",Negative,Negative,Positive,Negative
Ok,['ok'],Negative,Positive,Positive,Positive
Bagus,['bagus'],Positive,Positive,Positive,Positive
Saya melakukan topup SAKUKU ternyata saldo tidak bertambah sedangkan saldo di mBCA sudah terpotong. Bagaimana ini BCA?,"['topup', 'saku', 'saldo', 'tidak', 'tambah', 'saldo', 'mbca', 'potong', 'bca']",Negative,Positive,Positive,Positive
"Saya pake Bca Mobile tapi kenapa tidak ada notif apapun yaa,,jadi kalo ada yg tranfer atau apa harus buka aplikasi,,krnn tidak ada notif melalui aplkasi ataupun email,pdhl notifikasi sudah d aktifkan semua","['pakai', 'bca', 'mobile', 'tidak', 'notif', 'apa', 'ya', 'tranfer', 'buka', 'aplikasi', 'krnn', 'tidak', 'notif', 'aplkasi', 'email', 'notifikasi', 'aktif']",Negative,Negative,Negative,Negative
"tolong diperbaiki dong sistemnya min,masa login udh 6x gagal Mulu,padahal signal stabil hufff,kesel bget sma nih aplikasi","['tolong', 'baik', 'sistem', 'min', 'login', 'kali', 'gagal', 'mulu', 'signal', 'stabil', 'hufff', 'kesel', 'banget', 'nih', 'aplikasi']",Negative,Negative,Positive,Negative
Mempermudah yransaksi,"['mudah', 'yransaksi']",Negative,Positive,Positive,Positive
Semakin mudah melakukan transaksi online,"['mudah', 'transaksi', 'online']",Negative,Positive,Positive,Positive
Tidak bisa klik centang pada pernyataan M-BCA,"['tidak', 'klik', 'centang', 'nyata', 'bca']",Negative,Positive,Negative,Negative
Good,['good'],Negative,Positive,Positive,Positive
"Ternyata aplikasinya bikin ribet, saya buka tdk bisa suruh registrasi ulang sudah habis pulsa 50 RB belum berhasil juga, padahal masih ada saldo,jadi gak bisa digunakan,nyesel pakai aplikasi ini","['aplikasi', 'bikin', 'ribet', 'buka', 'tidak', 'suruh', 'registrasi', 'ulang', 'habis', 'pulsa', 'ribu', 'belum', 'hasil', 'masih', 'saldo', 'tidak', 'sesal', 'pakai', 'aplikasi']",Negative,Negative,Negative,Negative
"Bagus, juga lebih praktis..bisa bayar ansuransi dll. Unk penggunaan app, kalo pakai jaringan wifi kenapa ga bisa ya. Apa ada pengaturan yg salah, lalu gimana cara pengaturannya. Terima kasih.","['bagus', 'praktis', 'bayar', 'ansuransi', 'dll', 'unk', 'guna', 'aplikasi', 'pakai', 'jaring', 'wifi', 'tidak', 'ya', 'atur', 'salah', 'atur', 'terima', 'kasih']",Negative,Positive,Positive,Positive
Kurang Bagus,"['kurang', 'bagus']",Negative,Negative,Negative,Negative
Sangat mudah semoga membantu amanah,"['sangat', 'mudah', 'moga', 'bantu', 'amanah']",Negative,Positive,Positive,Positive
Penfaktifan saldo terlalu lambat harusnya setelah tranfer lewat pukul 24.00 saldo sudah masuk ini malah molor sistem terlalu lamban🤨🙂,"['penfaktifan', 'saldo', 'lambat', 'tranfer', 'saldo', 'masuk', 'molor', 'sistem', 'lamban']",Negative,Negative,Negative,Negative
Setelah di update punya saya tidak bisa dibuka. Macet di tulisan BCA saja.... Tolong dong..,"['update', 'tidak', 'buka', 'macet', 'tulis', 'bca', 'tolong']",Negative,Positive,Negative,Negative
Buruk sekali,['buruk'],Negative,Negative,Negative,Negative
"Kok jadi jelek skg ya, saya baca komen 30Nov ada yg tdk bs checklist krn ganti hp dan hrs install ulang kebetulan hp saya sama pula apa ini pengaruh? Dari kemarin hanya perjanjian yg keluar tp gk bs checklist. Lalu sdh install tp k playstore msh tombol install bkn buka,, hbs brp download trz. Thx","['jelek', 'ya', 'baca', 'komen', 'nov', 'tidak', 'checklist', 'ganti', 'hp', 'install', 'ulang', 'hp', 'pengaruh', 'kemarin', 'janji', 'tidak', 'checklist', 'install', 'playstore', 'masih', 'tombol', 'install', 'buka', 'habis', 'download', 'trz', 'thx']",Negative,Negative,Negative,Negative
Mantap deh,"['mantap', 'deh']",Negative,Positive,Positive,Positive
"Aplikasi kurang memuaskan , menghabiskan pulsa, sekali lupa password pengen reset aja ribetnya udah kaya apaan tau , ampun dah. Dateng ke cabang mau reset password malah disuruh lewat telepon , di telepon terputus Mulu huffttt capee capee","['aplikasi', 'kurang', 'muas', 'habis', 'pulsa', 'lupa', 'password', 'pengin', 'reset', 'ribetnya', 'kayak', 'tau', 'ampun', 'cabang', 'reset', 'password', 'suruh', 'telepon', 'telepon', 'putus', 'mulu', 'huffttt', 'cape', 'cape']",Negative,Negative,Negative,Negative
Sangat oke,"['sangat', 'oke']",Negative,Positive,Positive,Positive
Kenapa ya habis ganti hp baru mau masuk susah bgt padahal sdh masukin nomer ATM sesuai anjuran dan kirim sms tp tetap aja sdh dicoba berulang kali sampe capek tetap aja gak bisa masuk,"['ya', 'habis', 'ganti', 'hp', 'masuk', 'susah', 'banget', 'pasuk', 'nomer', 'atm', 'sesuai', 'anjur', 'kirim', 'sms', 'coba', 'ulang', 'kali', 'capek', 'tidak', 'masuk']",Negative,Negative,Negative,Negative
"Setiap mau pake, selalu ada tulisan SIM-card tidak sesuai dan juga minta verifikasi ulang, saya khawatir jadi error, apalagi saya sedang di luar negeri dan tidak bisa begitu saja mendapatkan akses ke kantor bank nya langsung. Mohon segera di perbaiki agar tidak tejadi hal yg di khawatirkan nasabah, beneran terjadi dan saya harus melakukan registrasi lagi beberapa kali hingga bisa saya gunakan kembali, biaya sms yg di bebankan saat saya di Luar negeri lumayan menguras saldo pulsa saya.","['pakai', 'tulis', 'sim', 'card', 'tidak', 'sesuai', 'verifikasi', 'ulang', 'khawatir', 'error', 'negeri', 'tidak', 'akses', 'kantor', 'bank', 'langsung', 'mohon', 'baik', 'tidak', 'tejadi', 'khawatir', 'nasabah', 'benar', 'registrasi', 'kali', 'biaya', 'sms', 'beban', 'negeri', 'lumayan', 'uras', 'saldo', 'pulsa']",Negative,Negative,Negative,Negative
Tak bisa bukak,['buka'],Negative,Negative,Positive,Negative
Buruk,['buruk'],Negative,Negative,Negative,Negative
Kenapa FC trus yaaa ini BCA skrg,"['fc', 'ya', 'bca']",Negative,Negative,Positive,Negative
"Tolong di bantu cara aktifasi Notifikasi uang masuk atau keluar ko ga ada muncul ya,,pemberitahuan uang masuk atau notif lain nya,?","['tolong', 'bantu', 'aktifasi', 'notifikasi', 'uang', 'masuk', 'tidak', 'muncul', 'ya', 'pemberitahuan', 'uang', 'masuk', 'notif']",Negative,Positive,Negative,Negative
"Tolong kembalikan font tulisan yang lama pada rekening koran, font yang baru tulisannya lebih kecil dari font lama sebelum perubahan jadi sulit untuk di baca, untuk kerja audit jadi tidak efisien dan makan waktu lebih lama","['tolong', 'kembali', 'font', 'tulis', 'rekening', 'koran', 'font', 'tulis', 'font', 'ubah', 'sulit', 'baca', 'kerja', 'audit', 'tidak', 'efisien', 'makan']",Negative,Positive,Positive,Positive
Aku ksh bintang 🌟🌟🌟🌟🌟 Sangat puas dan membantu,"['kasih', 'bintang', 'sangat', 'puas', 'bantu']",Negative,Positive,Positive,Positive
Mantab,['mantab'],Negative,Positive,Positive,Positive
Mantaap,['mantap'],Positive,Positive,Positive,Positive
"Baru nyadar, ternyata ga bisa hapus Inbox Transaksi, Ga kaya dulu, bisa edit apus satu""","['sadar', 'tidak', 'hapus', 'inbox', 'transaksi', 'tidak', 'kayak', 'edit', 'hapus']",Negative,Negative,Negative,Negative
"Mengapa setelah di-update malah nggak aksesibel buat tunanetra ya sangat mengecewakan padahal dulu aplikasi ini sangat membantu bagi tunanetra, mohon diperbaiki ya agar kami merasa lebih nyaman menggunakan aplikasi ini. Mohon diingat sebagian dari nasabah bank BCA adalah tunanetra yang harus didengar aspirasinya demi kenyamanan kami juga. Tombol m-banking nya sudah tidak terbaca juga tidak dapat diklik maksudnya bagaimana ya? Jangan bilang ini untuk meningkatkan kenyamanan bagi nasabah.","['update', 'tidak', 'aksesibel', 'tunanetra', 'ya', 'sangat', 'kecewa', 'aplikasi', 'sangat', 'bantu', 'tunanetra', 'mohon', 'baik', 'ya', 'nyaman', 'aplikasi', 'mohon', 'nasabah', 'bank', 'bca', 'tunanetra', 'dengar', 'aspirasi', 'nyaman', 'tombol', 'banking', 'tidak', 'baca', 'tidak', 'klik', 'maksud', 'ya', 'bilang', 'tingkat', 'nyaman', 'nasabah']",Negative,Negative,Positive,Negative
Tambah inovatif dan maju,"['inovatif', 'maju']",Negative,Positive,Positive,Positive
"kenapa verifikasi wajah tidak bisa? kamera jelas,bening parah nih !!","['verifikasi', 'wajah', 'tidak', 'kamera', 'bening', 'parah', 'nih']",Negative,Negative,Negative,Negative
Ok,['ok'],Negative,Positive,Positive,Positive
Aplikasi prik orang lagi buat buru² malah di suruh registrasi ulang,"['aplikasi', 'prik', 'orang', 'buru', 'suruh', 'registrasi', 'ulang']",Negative,Negative,Negative,Negative
Nice,['nice'],Negative,Positive,Positive,Positive
"Saya suka dengan adanya aplikasi ini, jadi kebutuhan soal transfer dalam belanja online dan mengetahui jumlah saldo dapat dengan mudah di ketahui.","['suka', 'aplikasi', 'butuh', 'transfer', 'belanja', 'online', 'saldo', 'mudah', 'tahu']",Negative,Positive,Positive,Positive
Kenapa dengan BCA gak bisa transaksi,"['bca', 'tidak', 'transaksi']",Negative,Positive,Negative,Negative
Sangat menikmati,"['sangat', 'nikmat']",Negative,Positive,Positive,Positive
Kenapa BCA mobile saya macet nggak bisa dibuka,"['bca', 'mobile', 'macet', 'tidak', 'buka']",Negative,Positive,Negative,Negative
bagus,['bagus'],Positive,Positive,Positive,Positive
"Saya setor tunai di mesin ATM yang ada di indomaret, saya setor tunai 3,5 juta sebelum nya sudah saya hitung juga, setelah saya masukin ke mesin proses setor tunai,tiba2 yang terhitung cuma 2,5 doanggg, 1 juta hilang , saya coba batalin pas yang keluar uang nya ngurang keliatan bgt,saya cba hubungi halo bca nyaa buat ngatasin masalah ini dan buat laporan, sampe saat ini pun masih di proses di cba di telpon lagi katanya gatau proses nya sampe kapan, sekelas BCA ga bsa ngtsin mslah kek gni","['setor', 'tunai', 'mesin', 'atm', 'indomaret', 'setor', 'tunai', 'juta', 'hitung', 'pasuk', 'mesin', 'proses', 'setor', 'tunai', 'hitung', 'doanggg', 'juta', 'hilang', 'coba', 'batalin', 'pas', 'uang', 'ngurang', 'banget', 'coba', 'hubung', 'halo', 'bca', 'ngatasin', 'lapor', 'masih', 'proses', 'coba', 'telpon', 'tidak', 'tau', 'proses', 'kelas', 'bca', 'tidak', 'ngtsin', 'mslah', 'kayak']",Negative,Negative,Positive,Negative
Ok,['ok'],Negative,Positive,Positive,Positive
Ok,['ok'],Negative,Positive,Positive,Positive
Selama ini lumayan membatu tapi setelah di install jadi susah masuk,"['lumayan', 'batu', 'install', 'susah', 'masuk']",Negative,Positive,Negative,Negative
Oke keren,"['oke', 'keren']",Positive,Positive,Positive,Positive
lebih update lagi ya seperti mbanking lain sudah bisa akses dengan finger print jadi tidak perlu repot masukkan kode akses manual,"['update', 'ya', 'mbanking', 'akses', 'finger', 'print', 'tidak', 'repot', 'masuk', 'kode', 'akses', 'manual']",Negative,Positive,Negative,Negative
Sangat bermanfaat sekali,"['sangat', 'manfaat']",Negative,Positive,Positive,Positive
mantap bgt pake bca,"['mantap', 'banget', 'pakai', 'bca']",Negative,Positive,Positive,Positive
Bagaimna solusi nya ini akun saya tiba2 log uot,"['solusi', 'akun', 'log', 'uot']",Negative,Negative,Positive,Negative
Sangat membantu,"['sangat', 'bantu']",Negative,Positive,Positive,Positive
BCA tolol. Makin tua makin tolol sistem nya.. Mbanking abis di update malah kaga bisa di buka..,"['bca', 'tolol', 'tua', 'tolol', 'sistem', 'mbanking', 'habis', 'update', 'kagak', 'buka']",Negative,Negative,Negative,Negative
Good job,"['good', 'job']",Negative,Positive,Positive,Positive
Mbking pin keblokir suruh daftar fi mesin atm sdh di lakukan fan sdh berhasil gak bisa juga malah suruh di suruh faftar fi atm lagi..mang lu kira gw punya mesin atm sendiri ?? Jauh bos..ribet bca mending pake mandiri.,"['mbking', 'pin', 'blokir', 'suruh', 'daftar', 'mesin', 'atm', 'laku', 'fan', 'hasil', 'tidak', 'suruh', 'suruh', 'faftar', 'atm', 'gue', 'mesin', 'atm', 'bos', 'ribet', 'bca', 'mending', 'pakai', 'mandiri']",Negative,Negative,Negative,Negative
"semakin bagus, transaksi online aman, saya suka transfer ke sodara jadi mudah, belanja online tinggal klik virtual acoune, bca mobile, andalan saya, saya sukaaa","['bagus', 'transaksi', 'online', 'aman', 'suka', 'transfer', 'sodara', 'mudah', 'belanja', 'online', 'tinggal', 'klik', 'virtual', 'acoune', 'bca', 'mobile', 'andal', 'suka']",Negative,Positive,Positive,Positive
Gangguan terus mau transaksi lewat dana,"['ganggu', 'transaksi', 'dana']",Negative,Negative,Positive,Negative
Mantaf sekali Kren pokonya,"['mantaf', 'keren', 'pokok']",Positive,Positive,Positive,Positive
Nice,['nice'],Negative,Positive,Positive,Positive
Ini kenapa ya aplikasi tidak bisa dibuka karena harus matikan aksesibilitas padahal saya tidak pernah mengaktifkan fitur tersebut. Mohon diperbaiki karena itu menghambat transaksi saya,"['ya', 'aplikasi', 'tidak', 'buka', 'mati', 'aksesibilitas', 'tidak', 'aktif', 'fitur', 'mohon', 'baik', 'hambat', 'transaksi']",Negative,Negative,Negative,Negative
Mantap,['mantap'],Positive,Positive,Positive,Positive
Makin gk jelas BCA mobile banking skrng . Setelah di update malah gk bisa dibuka.. padahal seluruh transaksi. saya lewat aplikasi ini biar gk ribet ke ATM malah bikin pusing mondar mandir ATM,"['tidak', 'bca', 'mobile', 'banking', 'update', 'tidak', 'buka', 'transaksi', 'aplikasi', 'biar', 'tidak', 'ribet', 'atm', 'bikin', 'pusing', 'mondar', 'mandir', 'atm']",Negative,Negative,Negative,Negative
Is the best,"['is', 'the', 'best']",Negative,Positive,Positive,Positive
Mudah penggunaannya.. 👍,"['mudah', 'guna']",Negative,Positive,Positive,Positive
"buruk , login susah , sering banyak kendala","['buruk', 'login', 'susah', 'kendala']",Negative,Negative,Negative,Negative
"Jaman sudah semakin maju, era digital semakin bsrkembang. Transaksi qr saldo terpotong tapi bukti transfer tidak keluar. Call halo bca suruh nunggu 2 minggu, payah.....masih aja pakai cara lama","['jaman', 'maju', 'era', 'digital', 'bsrkembang', 'transaksi', 'qr', 'saldo', 'potong', 'bukti', 'transfer', 'tidak', 'call', 'halo', 'bca', 'suruh', 'tunggu', 'minggu', 'payah', 'masih', 'pakai']",Negative,Negative,Negative,Negative
"saat registrasi dan masuk ke SMS kenapa tidak terkirim yaa, pdhl sinyal saya kenceng dan punya pulsa kenapa engga bisa terkirim SMS nya dan sudah berapa kali saya melakukan pengiriman SMS engga terkirim trs untungnya beralih ke myBCA lebih gampang dan engga perlu ribet kirim SMS","['registrasi', 'masuk', 'sms', 'tidak', 'kirim', 'ya', 'sinyal', 'kencang', 'pulsa', 'tidak', 'kirim', 'sms', 'kali', 'kirim', 'sms', 'tidak', 'kirim', 'untung', 'alih', 'mybca', 'gampang', 'tidak', 'ribet', 'kirim', 'sms']",Negative,Negative,Negative,Negative
"Tadi malam hapus data apps mbca. Pagi ini mau login, diminta mencentang 2 persetujuan. Nah terdapat error di sini. Saat 1 sudah diklik setuju, lanjut kedua. Kedua sudah di klik setuju eh yang tadi no 1 hilang lagi. Begitu terus. Jadinya gak bisa klik lanjutkan. Sudah dicoba instal ulang tetep aja gitu. Jadi skrg sy belum bisa pake mbca saya. BCA please help me...","['malam', 'hapus', 'data', 'apps', 'mbca', 'pagi', 'login', 'centang', 'tuju', 'error', 'klik', 'tuju', 'klik', 'tuju', 'eh', 'no', 'hilang', 'tidak', 'klik', 'lanjut', 'coba', 'instal', 'ulang', 'belum', 'pakai', 'mbca', 'bca', 'please', 'help', 'me']",Negative,Negative,Negative,Negative
Puas dengan pelayanan bca,"['puas', 'layan', 'bca']",Negative,Positive,Positive,Positive
"Ini kenapa yah pas verifikasi wajah tidak terbaca terus,","['ya', 'pas', 'verifikasi', 'wajah', 'tidak', 'baca']",Negative,Positive,Positive,Positive
"saya gabia login, cuma gara² gabiaa ceklis di pas persetujuan awal itu. mohon bantuannya min","['gabia', 'login', 'gara', 'gabiaa', 'ceklis', 'pas', 'tuju', 'mohon', 'bantu', 'min']",Negative,Negative,Positive,Negative
CSnya ga jelas verefikasi mbanking aja susah banget ngapain isi pulsa dari tadi kalau tetap harus ke kantor bca,"['csnya', 'tidak', 'verefikasi', 'mbanking', 'susah', 'banget', 'kapai', 'isi', 'pulsa', 'kantor', 'bca']",Negative,Negative,Negative,Negative
"Sekarang BCA Ruwet, verifikasi ATM BCA susah sekali, habil.pulsa banyak daftar kuota beberapa kali, masih ga bisa bisa masuk. Parahh!","['bca', 'ruwet', 'verifikasi', 'atm', 'bca', 'susah', 'habil', 'pulsa', 'daftar', 'kuota', 'kali', 'masih', 'tidak', 'masuk', 'parah']",Negative,Negative,Negative,Negative
Ini kenapa BCA gangguan kah? MLM ini tgl 9 /11/2024 tolong di jls ken,"['bca', 'ganggu', 'kah', 'malam', 'tanggal', 'tolong', 'jls', 'ken']",Negative,Negative,Negative,Negative
Tai gede bet bunga nya anjer,"['tahi', 'gede', 'banget', 'bunga', 'anjer']",Negative,Negative,Negative,Negative
sangat membantu,"['sangat', 'bantu']",Negative,Positive,Positive,Positive
"APLIKASI JELEKKK, MALES BANGET TRANSAKSI PAKE INI, SUSAH BANGET PAKENYAAA GAK NGERTIII JADI NYESEL PAKE BCA","['aplikasi', 'jelekkk', 'malas', 'banget', 'transaksi', 'pakai', 'susah', 'banget', 'pakenyaaa', 'tidak', 'ngertiii', 'sesal', 'pakai', 'bca']",Negative,Negative,Negative,Negative
Pelayanan BCA luar biasa🙏🏼🙏🏼🙏🏼🙏🏼,"['layan', 'bca']",Negative,Positive,Positive,Positive
"Kenapa ga bisa verifikasi sms ya, padahal di atm udah diganti nomornya, jadi ribet bgt deh bca","['tidak', 'verifikasi', 'sms', 'ya', 'atm', 'ganti', 'nomor', 'ribet', 'banget', 'deh', 'bca']",Negative,Negative,Negative,Negative
Mantapp,['mantap'],Positive,Positive,Positive,Positive
"SMS konfirmasi ngk pernah keluar ngk mau lanjut sudah saya tunggu seharian penuh ngk keluar"" juga","['sms', 'konfirmasi', 'tunggu', 'hari', 'penuh']",Negative,Negative,Positive,Negative
Terima kasih M Bank king Memudahkan kita semua ada nya BCA Bank king,"['terima', 'kasih', 'bank', 'king', 'mudah', 'bca', 'bank', 'king']",Negative,Positive,Positive,Positive
The best,"['the', 'best']",Negative,Positive,Positive,Positive
terkadang lampu warna biru,"['terkadang', 'lampu', 'warna', 'biru']",Negative,Positive,Positive,Positive
Itu ku ingin uwong sing penting uuuu,"['ku', 'uwong', 'sing', 'uuuu']",Negative,Negative,Positive,Negative
"Kenapa di perangkat saya harus menonaktifkan aksesibilitas agar dapat menggunakan App, sebelumnya tidak ada peringatan ini","['perangkat', 'nonaktif', 'aksesibilitas', 'aplikasi', 'tidak', 'ingat']",Negative,Positive,Negative,Negative
"Ribet, mau verifikasi data gagal mulu, pdahal ws bener...aneh","['ribet', 'verifikasi', 'data', 'gagal', 'mulu', 'ws', 'aneh']",Negative,Negative,Negative,Negative
sangat puas,"['sangat', 'puas']",Negative,Positive,Positive,Positive
Aplikasi dancuk buang buang pulsa aja buat SMS beralasan koneksi terputus padahal pake wifi Aplikasi dancuk,"['aplikasi', 'dancuk', 'buang', 'buang', 'pulsa', 'sms', 'alas', 'koneksi', 'putus', 'pakai', 'wifi', 'aplikasi', 'dancuk']",Negative,Negative,Negative,Negative
maaf Min knpa saya gk bisa download aplikasi nya ? itu karena hp saya apa versi nya udh ganti. mohon minta saran nya Min.,"['maaf', 'min', 'tidak', 'download', 'aplikasi', 'hp', 'versi', 'ganti', 'mohon', 'saran', 'min']",Negative,Negative,Negative,Negative
"Indikator merah mulu, gak ijo2 jadi gak bisa transaksi, aneh","['indikator', 'merah', 'mulu', 'tidak', 'ijo', 'tidak', 'transaksi', 'aneh']",Negative,Negative,Negative,Negative
Sangat bagus,"['sangat', 'bagus']",Negative,Positive,Positive,Positive
Pelayanan Baik.... Harus lebih cepat loadingnya....,"['layan', 'baik', 'cepat', 'loadingnya']",Negative,Positive,Positive,Positive
"loading masuk kelamaan, tolong lah","['loading', 'masuk', 'tolong']",Negative,Positive,Negative,Negative
"Ini bca mobile ya kenapa lampunya merah trs ya,,,tolong dong d perbaiki aku ingin melakukan transaksi","['bca', 'mobile', 'ya', 'lampu', 'merah', 'ya', 'tolong', 'baik', 'transaksi']",Negative,Positive,Positive,Positive
Sangan membantu d smua transaksi,"['sangan', 'bantu', 'transaksi']",Negative,Positive,Positive,Positive
Good,['good'],Negative,Positive,Positive,Positive
Ini app nya gimana nih... Sering verifikasi ulang trus...kartu ATMnya Padahal dah berapa kali verifikasi tp masih tetap kek gitu trus.... Saya mohon di perbaiki lagi dong... Mw login masuk aja bikin ribet...,"['aplikasi', 'nih', 'verifikasi', 'ulang', 'kartu', 'atmnya', 'kali', 'verifikasi', 'masih', 'kayak', 'mohon', 'baik', 'login', 'masuk', 'bikin', 'ribet']",Negative,Negative,Negative,Negative
Terbaik,['baik'],Positive,Positive,Positive,Positive
Mantap,['mantap'],Positive,Positive,Positive,Positive
"Memudah kan di setiap kota,,,bisa belanja tanpa ribet,,,terima kasih BCA🙏","['mudah', 'kota', 'belanja', 'ribet', 'terima', 'kasih', 'bca']",Negative,Positive,Positive,Positive
u/melihat transferan masuk lebih cepat...u/pembayaran lebih gampang dan nyaman,"['umelihat', 'transfer', 'masuk', 'cepat', 'upembayaran', 'gampang', 'nyaman']",Negative,Positive,Positive,Positive
"Seriusan ini, SOP BCA utk konfirmasi aktivasi finansial m-bca cuma di telepon 1X dr Halo BCA. klo gak ke angkat gak bakal di aktivasi ? GILA LO. Tadi saya di telp Halo BCA dgn nomor 1500888 utk konfirmasi ulang aktivasi finansial karena posisi di jalan lagi setir kendaraan, gak bisa di angkat dan saya coba tunggu tapi gak di telpon lagi. Pgn telpon balik ngabisin pulsa. Bikin SOP 3X telpon dong jgn cuma 1X, di kira org gak punya aktivitas kali.","['serius', 'sop', 'bca', 'konfirmasi', 'aktivasi', 'finansial', 'bca', 'telepon', 'kali', 'halo', 'bca', 'tidak', 'angkat', 'tidak', 'aktivasi', 'gila', 'lo', 'telp', 'halo', 'bca', 'nomor', 'konfirmasi', 'ulang', 'aktivasi', 'finansial', 'posisi', 'jalan', 'setir', 'kendara', 'tidak', 'angkat', 'coba', 'tunggu', 'tidak', 'telpon', 'pengin', 'telpon', 'ngabisin', 'pulsa', 'bikin', 'sop', 'kali', 'telpon', 'kali', 'orang', 'tidak', 'aktivitas', 'kali']",Negative,Negative,Negative,Negative
"Maybe saya tetap pakai BCA Tapi saya kecewa dilempar sana sini namnaya SOP saya ikhlaskan saja Saldo saya terpotong tapi rating saya naikin sedikit saja ya maaf, saya bukan perihal saldo terpotongnya berapa tapi harus diperhatikan unrung saldo nominal kecil kalau besar kacau, diperhatiakan layanannya lagi, saya isi pulsa lagi hari ini bisa dan masuk berarti tanggal 8 ada kesalahan di server anda terima kasih","['maybe', 'pakai', 'bca', 'kecewa', 'lempar', 'namnaya', 'sop', 'ikhlas', 'saldo', 'potong', 'rating', 'naikin', 'ya', 'maaf', 'perihal', 'saldo', 'potong', 'perhati', 'unrung', 'saldo', 'nominal', 'kacau', 'diperhatiakan', 'layan', 'isi', 'pulsa', 'masuk', 'tanggal', 'salah', 'server', 'terima', 'kasih']",Negative,Negative,Negative,Negative
"Dalam bbrp Minggu ini, kenapa kalau mau Transfer ke selain Bank BCA kok selalu error ya? Padahal menu transfer yang lain lancar? Tolong segera diperbaiki","['minggu', 'transfer', 'bank', 'bca', 'error', 'ya', 'menu', 'transfer', 'lancar', 'tolong', 'baik']",Negative,Negative,Positive,Negative
Sangat membantu aplikasi nya,"['sangat', 'bantu', 'aplikasi']",Negative,Positive,Positive,Positive
"sensitif banget hanya karena sering ganti kartu sim card, jadi ga bisa akses mBCA lagi","['sensitif', 'banget', 'ganti', 'kartu', 'sim', 'card', 'tidak', 'akses', 'mbca']",Negative,Negative,Negative,Negative
sangat membantu bertransaksi,"['sangat', 'bantu', 'transaksi']",Negative,Positive,Positive,Positive
"Astagfirullah ini verifikasi wajah nya sangat susah sekali, padah pake muka sendiri tpi gk kedeteksi terus, malahan jadi aral ke saya nya","['astagfirullah', 'verifikasi', 'wajah', 'sangat', 'susah', 'padah', 'pakai', 'muka', 'tidak', 'deteksi', 'aral']",Negative,Negative,Negative,Negative
Knp m-banking gua suka keluar terus ya 1 bulan bisa 5 kali loh. Bikin buang buang pulsa aja,"['banking', 'gua', 'suka', 'ya', 'kali', 'loh', 'bikin', 'buang', 'buang', 'pulsa']",Negative,Negative,Negative,Negative
Perusahaan sebesar BCA tidak mampu menyelesaikan keluhan customer. Dulu tidak seperti ini jaringan tidak stabil pun masih bisa akses.. sekarang pakai wifi pun untuk buka BCA mobile susah nya setengah mati...,"['usaha', 'bca', 'tidak', 'selesai', 'keluh', 'customer', 'tidak', 'jaring', 'tidak', 'stabil', 'masih', 'akses', 'pakai', 'wifi', 'buka', 'bca', 'mobile', 'susah', 'mati']",Negative,Negative,Negative,Negative
"Gajelas tiba² disuruh verifikasi ulang, giliran udah di verifikasi ulang malah kode nya ga nongol. Padahal pulsa udah kepotong","['tidak', 'suruh', 'verifikasi', 'ulang', 'gilir', 'verifikasi', 'ulang', 'kode', 'tidak', 'nongol', 'pulsa', 'potong']",Negative,Negative,Negative,Negative
Mudah aman,"['mudah', 'aman']",Negative,Positive,Positive,Positive
Mudah di gunakan,['mudah'],Negative,Positive,Positive,Positive
Mantap,['mantap'],Positive,Positive,Positive,Positive
Bagus mantap,"['bagus', 'mantap']",Negative,Positive,Positive,Positive
Mempermudah urusan,"['mudah', 'urus']",Negative,Positive,Positive,Positive
Membantu banget,"['bantu', 'banget']",Negative,Positive,Positive,Positive
Jaya selalu BCA,"['jaya', 'bca']",Negative,Positive,Positive,Positive
segalanya jadi lebih mudah,['mudah'],Negative,Positive,Positive,Positive
"Kirim otp sampai 50X ngak di kirim"" . Makin Ngak jelas ini","['kirim', 'otp', 'kali', 'tidak', 'kirim', 'tidak']",Negative,Negative,Negative,Negative
Masa mau gapus pesan terasfer harus apdet lagi.,"['gapus', 'pesan', 'terasfer', 'apdet']",Negative,Negative,Negative,Negative
"Kenapa potongan nya 50rb ya per bulan, di cek mutasi ga ada keterangan potongan.., udah 2 bulan berturut-turut kejadian nya..!!","['potong', 'ribu', 'ya', 'cek', 'mutasi', 'tidak', 'terang', 'potong', 'jadi']",Negative,Negative,Negative,Negative
banyak eror nya,['eror'],Negative,Negative,Negative,Negative
Selalu tdk bisa dibuka. Tolong diperbaiki lagi agar bisa di akses,"['tidak', 'buka', 'tolong', 'baik', 'akses']",Negative,Negative,Positive,Negative
Mantap,['mantap'],Positive,Positive,Positive,Positive
Bank terbaik,"['bank', 'baik']",Positive,Positive,Positive,Positive
Sangat membantu,"['sangat', 'bantu']",Negative,Positive,Positive,Positive
Mantap,['mantap'],Positive,Positive,Positive,Positive
Ko inbok nya gabisa di hapus sekarang mah .. knp ???????,"['inbok', 'tidak', 'hapus', 'mah']",Negative,Positive,Negative,Negative
Bagus,['bagus'],Positive,Positive,Positive,Positive
